Name,Brand,Price,Old Price,Discount,Stock,Rating,Reviews,First Comment,Second Comment,Seller Info,Seller Performance
"Boutique OfficielleLogitech M90 Souris Filaire USB, Suivi Optique 1000 PPP, Ambidextre, Compatible avec PC/Mac/Portable - Gris",Marque: Logitech ,39.00 Dhs,69.00 Dhs,43%,Disponible,3.5 out of 5,(6 avis vérifiés),Nan,Nan,100%Évaluation du vendeur,Nan
Boutique OfficielleSony Casque CH520 Bluetooth Noir (WH-CH520 /BZ),Marque: Sony ,599.00 Dhs,799.00 Dhs,25%,Nan,4.6 out of 5,(8 avis vérifiés),Nan,Nan,94%Évaluation du vendeur67 AbonnésSuivre,Performance vendeurVitesse d'expédition: ExcellentScore Qualité: BonAvis des consommateurs: Excellent
Boutique OfficielleLenovo PC PORTABLE ThinkPad L570 -Core i5-6TH GEN-SSD 256Go -8Go-AZERTY-REMIS A NEUF,Marque: Lenovo ,"2,999.00 Dhs","4,499.00 Dhs",33%,Nan,2.3 out of 5,(6 avis vérifiés),Nan,Nan,46%Évaluation du vendeur249 AbonnésSuivre,Performance vendeurVitesse d'expédition: BonScore Qualité: Très MauvaisAvis des consommateurs: Moyen
"Boutique OfficielleLogitech Zone Vibe 100 Casque d'écoute léger sans fil avec Micro anti-bruit de fond, Écouteurs Bluetooth multipoint avancés, Fonctionne avec Teams, Google Meet, Zoom, Mac/PC- Graphite",Marque: Logitech ,"1,199.00 Dhs","1,999.00 Dhs",40%,5 articles seulement,0 out of 5,(Pas d'avis disponibles),Nan,Nan,100%Évaluation du vendeur,Nan
"Boutique OfficiellePack gaming all in one 4 en 1 clavier gamer, souris 7 buttons + casque et tapis",Les commandes Jumia Express sont éligibles à la livraison gratuite. Offre soumise à conditionsAdieu au temps perdu aux péages. Rechargez votre Pass Jawaz maintenant et gagnez votre temps !,210.00 Dhs,409.50 Dhs,49%,Disponible,3.8 out of 5,(64 avis vérifiés),4 out of 5bon produita part le casque qui a un problème de son alors que mon ancien casque produit du son pas comme si c'est très loin14-10-2024par HassanAchat vérifié,5 out of 5كل شيءاعجب ابني07-10-2024par MeriamAchat vérifié,74%Évaluation du vendeur2161 AbonnésSuivre,Performance vendeurVitesse d'expédition: ExcellentScore Qualité: MoyenAvis des consommateurs: Moyen
"DELL Optiplex 3020 MT Intel Celeron @ 2.7GHz - RAM 4Go , HDD 500Go (Remis à Neuf)",Marque: DELL ,530.00 Dhs,"1,250.00 Dhs",58%,4 articles seulement,4.2 out of 5,(26 avis vérifiés),5 out of 5meedمليح 16-10-2024par محمدAchat vérifié,5 out of 5bonmabihech ca marche25-09-2024par AbdeljabbarAchat vérifié,74%Évaluation du vendeur788 AbonnésSuivre,Performance vendeurVitesse d'expédition: ExcellentScore Qualité: MauvaisAvis des consommateurs: Bon
"Console de jeu vidéo sans fil, écran HD 4K 64Gb HDMI avec 10000 jeux + 2 Manettes",Les commandes Jumia Express sont éligibles à la livraison gratuite. Offre soumise à conditionsAdieu au temps perdu aux péages. Rechargez votre Pass Jawaz maintenant et gagnez votre temps !,255.00 Dhs,510.00 Dhs,50%,Disponible,3.8 out of 5,(56 avis vérifiés),1 out of 5la ansah ahad bichiraLmantoj  ziro14-10-2024par AbdoAchat vérifié,"3 out of 5Pas MalPas mal pour le prix 
ça bug beaucoup et pas mal de jeux ne sont pas opérationnels !26-08-2024par AhmedAchat vérifié",74%Évaluation du vendeur2161 AbonnésSuivre,Performance vendeurVitesse d'expédition: ExcellentScore Qualité: MoyenAvis des consommateurs: Moyen
Epson EcoTank L3250 Imprimante WiFi multifonction à réservoirs rechargeables,Marque: Epson ,"1,875.00 Dhs","2,500.00 Dhs",25%,Nan,3.8 out of 5,(15 avis vérifiés),Nan,Nan,66%Évaluation du vendeur203 AbonnésSuivre,Performance vendeurVitesse d'expédition: BonScore Qualité: MoyenAvis des consommateurs: Moyen
"Boutique OfficielleJedel Clavier Mécanique KL-95 à lumière mixte, avec effet de lumière RGB personnalisé",Marque: Jedel ,248.00 Dhs,475.00 Dhs,48%,Nan,4.4 out of 5,(125 avis vérifiés),1 out of 5some of my keybord keys is not woking lsome of my keybord keys is not woking like w and windows i dont know what to do14-10-2024par yassineAchat vérifié,5 out of 5نغمة فيه يا سلامأول مرة نقول عندي كلافيي شي حاجة ناضية بالروجولة28-08-2024par BrahimAchat vérifié,74%Évaluation du vendeur2161 AbonnésSuivre,Performance vendeurVitesse d'expédition: ExcellentScore Qualité: MoyenAvis des consommateurs: Moyen
"Caméra de surveillance extérieure sans fil, avec panneau solaire et audio PIR, 4G et Wifi",Les commandes Jumia Express sont éligibles à la livraison gratuite. Offre soumise à conditionsAdieu au temps perdu aux péages. Rechargez votre Pass Jawaz maintenant et gagnez votre temps !,"1,399.00 Dhs","2,090.00 Dhs",33%,Disponible,5 out of 5,(1 avis vérifié),Nan,Nan,74%Évaluation du vendeur2161 AbonnésSuivre,Performance vendeurVitesse d'expédition: ExcellentScore Qualité: MoyenAvis des consommateurs: Moyen
XIAOMI Mi Smart Camera C200 1080P Caméra Surveillance WiFi intérieure 360° qualité,Marque: XIAOMI ,343.00 Dhs,529.00 Dhs,35%,Disponible,4.8 out of 5,(32 avis vérifiés),5 out of 5usefulNef3atni bzaf 19-09-2024par YoussiAchat vérifié,3 out of 5ysfFonctionne bien 09-09-2024par MohamedAchat vérifié,86%Évaluation du vendeur3586 AbonnésSuivre,Performance vendeurVitesse d'expédition: ExcellentScore Qualité: BonAvis des consommateurs: Bon
Dml Casque Gamer  casque PC avec  son surround casque antibruit avec micro et lumière LED,Marque: Dml ,145.00 Dhs,159.00 Dhs,9%,Nan,4.1 out of 5,(110 avis vérifiés),4 out of 5bonqualité bonne01-10-2024par ImadAchat vérifié,3 out of 5casque daizaKain 7sn sara7a lcable khari ghadi tlwa bzrba ou khass tb9a tl3ab bih Bach tsma305-09-2024par mokAchat vérifié,86%Évaluation du vendeur541 AbonnésSuivre,Performance vendeurVitesse d'expédition: ExcellentScore Qualité: BonAvis des consommateurs: Bon
"TP-Link Point d'Acces 1200Mbps Dual Band Wi-Fi - Access Point , Répéteur WiFi 2 in 1 Archer C54",Marque: TP-Link ,499.00 Dhs,750.00 Dhs,33%,8 articles seulement,4.3 out of 5,(3 avis vérifiés),"5 out of 5niceBon produit 
03-09-2024par H.HAchat vérifié",5 out of 5Meilleur Point D'accésBon Rapport prix/qualité19-08-2024par AMINEAchat vérifié,60%Évaluation du vendeur576 AbonnésSuivre,Performance vendeurVitesse d'expédition: BonScore Qualité: Très MauvaisAvis des consommateurs: Excellent
"Boutique OfficielleLogitech G733 Casque gaming sans fil LIGHTSPEED avec bandeau de suspension, LIGHTSYNC RVB, technologie de micro Blue VO!CE et transducteurs audio PRO-G - Blanc",Marque: Logitech ,"1,499.00 Dhs","2,099.00 Dhs",29%,2 articles seulement,0 out of 5,(Pas d'avis disponibles),Nan,Nan,100%Évaluation du vendeur,Nan
mifoy Pack Combo Clavier de Jeu + Souris GM100 6 Boutons RGB Capteur Optique DPI LED,Marque: mifoy ,139.00 Dhs,299.00 Dhs,54%,Disponible,4 out of 5,(40 avis vérifiés),"1 out of 5Je n'aime pas ça.Clavier trop petit, Le cable du clavier et de la souris sont trop petit aussi. Le clavier est fragile et d'une mauvaise qualité
Très mauvaise affaire! je regrette acheter ce produit et surtout le clavier. 
Si vous chercher quelque chose de bon, je vous déconseille de prendre ce Pack.
Sur l'image le clavier apparaît grand mais sérieusement c'est le plus petit clavier de toute la planète. Je suis vraiment surpris. ça vaut même pas 20 Dh ce clavier. C'est une arnaque de le vendre à ce prix avec la souris.
La souris devrait être vendu à 50 Dh et le clavier à 20 Dh, le total 70 Dh. 
J'ai un PC Gamer et je ne peux même pas être comfortable avec ces petit cables...c'est vraiment ridicule ce que vous faites.  153 dh le total avec la livraison c'est la honte! La souris est tout à fait normal rien de spécial à part le DPI est élever, mais en général ça ne vaut pas le coup
Je me suis fais arnaquer. La prochaine fois je vais acheter chez Aliexpress au lieu de Jumia, parce que eux en moins ils peuvent me faire un remboursement même si je ne retourne pas la marchandise.25-09-2024par OussamaAchat vérifié",5 out of 5ممتازةالجودة ممتازة11-09-2024par SaadAchat vérifié,74%Évaluation du vendeur2161 AbonnésSuivre,Performance vendeurVitesse d'expédition: ExcellentScore Qualité: MoyenAvis des consommateurs: Moyen
"Boutique OfficielleLenovo Sac à dos ThinkPad Sac de voyage manche en velours, grande capacité",Marque: Lenovo ,169.00 Dhs,250.00 Dhs,32%,Disponible,4.4 out of 5,(134 avis vérifiés),"5 out of 5Bonne qualitéBonne qualité, peut porter un pc 17.3"" à l'aise.03-10-2024par OmarAchat vérifié","2 out of 5moyen5/10

5/1002-10-2024par AbdoAchat vérifié",86%Évaluation du vendeur541 AbonnésSuivre,Performance vendeurVitesse d'expédition: ExcellentScore Qualité: BonAvis des consommateurs: Bon
"Support pliable pour ordinateur Portable Mac et PC, en Aluminium, Support Antidérapant",Les commandes Jumia Express sont éligibles à la livraison gratuite. Offre soumise à conditionsAdieu au temps perdu aux péages. Rechargez votre Pass Jawaz maintenant et gagnez votre temps !,75.00 Dhs,195.00 Dhs,62%,Disponible,4.2 out of 5,(111 avis vérifiés),5 out of 5pas malQualité/prix je le recommande 18-10-2024par RimeAchat vérifié,"4 out of 5Bon choix Bon article 
Qualité/prix17-10-2024par Mohamed amine BAchat vérifié",74%Évaluation du vendeur2161 AbonnésSuivre,Performance vendeurVitesse d'expédition: ExcellentScore Qualité: MoyenAvis des consommateurs: Moyen
"Boutique OfficiellePack gaming all in one 4 en 1 clavier gamer, souris 7 buttons + casque et tapis",Les commandes Jumia Express sont éligibles à la livraison gratuite. Offre soumise à conditionsAdieu au temps perdu aux péages. Rechargez votre Pass Jawaz maintenant et gagnez votre temps !,210.00 Dhs,409.50 Dhs,49%,Disponible,3.8 out of 5,(64 avis vérifiés),4 out of 5bon produita part le casque qui a un problème de son alors que mon ancien casque produit du son pas comme si c'est très loin14-10-2024par HassanAchat vérifié,5 out of 5كل شيءاعجب ابني07-10-2024par MeriamAchat vérifié,74%Évaluation du vendeur2161 AbonnésSuivre,Performance vendeurVitesse d'expédition: ExcellentScore Qualité: MoyenAvis des consommateurs: Moyen
G2000 Casque Gaming,Les commandes Jumia Express sont éligibles à la livraison gratuite. Offre soumise à conditionsAdieu au temps perdu aux péages. Rechargez votre Pass Jawaz maintenant et gagnez votre temps !,149.00 Dhs,649.00 Dhs,77%,Nan,4.1 out of 5,(35 avis vérifiés),5 out of 5goodGooood05-09-2024par anonymousAchat vérifié,4 out of 5Pas malLe son et pas clair11-07-2024par محمدAchat vérifié,74%Évaluation du vendeur788 AbonnésSuivre,Performance vendeurVitesse d'expédition: ExcellentScore Qualité: MauvaisAvis des consommateurs: Bon
XIAOMI Monitor A22i 2145in 24W Max 75Hz Aspect ratio 169,Marque: XIAOMI ,853.00 Dhs,"1,099.00 Dhs",22%,Nan,4.7 out of 5,(26 avis vérifiés),5 out of 5زويناWa3ra wlah chriwha 3la 7sabi12-09-2024par AbdelaliAchat vérifié,4 out of 5شاشة ممتازةجيدة جدا26-08-2024par HamzaAchat vérifié,86%Évaluation du vendeur3586 AbonnésSuivre,Performance vendeurVitesse d'expédition: ExcellentScore Qualité: BonAvis des consommateurs: Bon
mifoy M10 Souris Filaire Optique USB Effet Lumineuse RGB E-sport pour Ordinateur,Marque: mifoy ,25.00 Dhs,70.00 Dhs,64%,Disponible,3.8 out of 5,(320 avis vérifiés),"5 out of 5sourisDe prime à bord j' ai été surpris par le fait que cette source est avec câble mais en fin de compte j' ai trouvé que c'était bien, aussi ses couleurs sont magnifiques 07-10-2024par LAHSENAchat vérifié",1 out of 5na9ssaBien01-10-2024par YASSINEAchat vérifié,74%Évaluation du vendeur2161 AbonnésSuivre,Performance vendeurVitesse d'expédition: ExcellentScore Qualité: MoyenAvis des consommateurs: Moyen
"Tapis de Souris Pour PC Bureau, PC Portable",Les commandes Jumia Express sont éligibles à la livraison gratuite. Offre soumise à conditionsAdieu au temps perdu aux péages. Rechargez votre Pass Jawaz maintenant et gagnez votre temps !,23.00 Dhs,35.00 Dhs,34%,Disponible,4.1 out of 5,(33 avis vérifiés),5 out of 5bon sans plusFait l'affaire 23-09-2024par KARIMAchat vérifié,5 out of 5AvisBon qualité06-03-2024par AbdelghaniAchat vérifié,86%Évaluation du vendeur541 AbonnésSuivre,Performance vendeurVitesse d'expédition: ExcellentScore Qualité: BonAvis des consommateurs: Bon
Western Digital Disque dur Externe 500GB - WD Elements™ - USB 3.0,Marque: Western Digital ,219.00 Dhs,750.00 Dhs,71%,Nan,4.3 out of 5,(68 avis vérifiés),1 out of 5منتوج.  سيئ.   لا أنصح بشرائه إشتريته. ووجته. مستعمل.  العلبة. WD. والقرص.  Samsung 17-07-2024par Zine el abidineAchat vérifié,"1 out of 5منتوج مغشوشللاسف بعد استعمال برنامج Crystal Desk Info تبين أن Disque Dur ديجا خادم سنتين و مئتين و سبعة عشر يوم. 

ما خدمة ما والو هادي ...15-07-2024par NabilAchat vérifié",94%Évaluation du vendeur189 AbonnésSuivre,Performance vendeurVitesse d'expédition: BonScore Qualité: ExcellentAvis des consommateurs: Excellent
Razer Tapis de souris lines 900 x 300 MM Tapis gamer souris et clavier Gaming Mouse Pad,Marque: Razer ,49.00 Dhs,49.00 Dhs,0,Disponible,4.3 out of 5,(4 avis vérifiés),Nan,Nan,94%Évaluation du vendeur354 AbonnésSuivre,Performance vendeurVitesse d'expédition: ExcellentScore Qualité: ExcellentAvis des consommateurs: Bon
Boutique OfficielleSH 3200 DPI réglables et 7D LED Optique Souris de jeu filaire USB pour Gamer PC,Marque: SH ,65.00 Dhs,150.00 Dhs,57%,Disponible,4.4 out of 5,(78 avis vérifiés),5 out of 5nadiaNadia07-10-2024par MohammedAchat vérifié,5 out of 5great mouse Bmo9arana m3a price dyalha  mouse perfect for big hands and comfortable 01-10-2024par AchrafAchat vérifié,74%Évaluation du vendeur2161 AbonnésSuivre,Performance vendeurVitesse d'expédition: ExcellentScore Qualité: MoyenAvis des consommateurs: Moyen
Adaptateur hdmi vga - hdmi vert vga - hdmi to vga,Marque: Adaptateur ,39.50 Dhs,65.00 Dhs,39%,Disponible,4.1 out of 5,(321 avis vérifiés),5 out of 5bon prixخدام زوين او تمان مناسب30-08-2024par yahyaAchat vérifié,5 out of 5j'aimeBon Produit qualiter raisonnable15-07-2024par YASSIRAchat vérifié,86%Évaluation du vendeur541 AbonnésSuivre,Performance vendeurVitesse d'expédition: ExcellentScore Qualité: BonAvis des consommateurs: Bon
"Boutique OfficielleLogitech H111 Casque Filaire, Ecouteurs Stéréo avec Micro Anti-Parasite, Jack Audio 3,5mm, PC/Mac/Portable/Smartphone/Tablette - Noir",Marque: Logitech ,99.00 Dhs,169.00 Dhs,41%,Disponible,4.4 out of 5,(22 avis vérifiés),5 out of 5bon produilivraison rapide et un bon produit pour le personnel et professionnel14-10-2024par HassanAchat vérifié,"4 out of 5Good but noisy for other around youProduct Good, sound Good, mic clear & clean, but people around you hear noise. if you are in the office will disturb others01-10-2024par abdelhamidAchat vérifié",100%Évaluation du vendeur,Nan
"Boutique OfficielleLogitech M171 Souris Sans Fil pour PC, Mac, Ordinateur portable, 2,4 GHz avec Mini-récepteur USB, Suivi Optique, Autonomie de Piles de 12 mois, Ambidextre- Noir",Marque: Logitech ,99.00 Dhs,169.00 Dhs,41%,Disponible,4.8 out of 5,(6 avis vérifiés),5 out of 5excellentSouris original Logitech très bonne qualité 11-10-2024par KARIMAchat vérifié,5 out of 5j'aime bienmerci beaucoup équipe jumia09-09-2024par abderrahimAchat vérifié,100%Évaluation du vendeur,Nan
Boutique Officiellemifoy Souris Gaming USB GM100 6 Boutons RGB Capteur Optique 1200 à 3200 DPI LED - Noir,Marque: mifoy ,59.00 Dhs,190.00 Dhs,69%,Disponible,4.3 out of 5,(109 avis vérifiés),4 out of 5المغرب Nadia w mt9ilax bzzzf nnsa7 biha w mghalyax bzzf 05-08-2024par AdilAchat vérifié,5 out of 5Contente ☺️C’est un bon service 17-07-2024par Bernorine KiakaAchat vérifié,74%Évaluation du vendeur2161 AbonnésSuivre,Performance vendeurVitesse d'expédition: ExcellentScore Qualité: MoyenAvis des consommateurs: Moyen
"Boutique OfficielleLogitech M90 Souris Filaire USB, Suivi Optique 1000 PPP, Ambidextre, Compatible avec PC/Mac/Portable - Gris",Marque: Logitech ,39.00 Dhs,69.00 Dhs,43%,Disponible,3.5 out of 5,(6 avis vérifiés),Nan,Nan,100%Évaluation du vendeur,Nan
Boutique OfficielleHp PC PORTABLE HP ELITEBOOK 840 G5 8ÉME GÉN-CORE I5-8Go-256 Go SSD-Remise à neuf,Marque: Hp ,"2,990.00 Dhs","6,599.00 Dhs",55%,Nan,4.2 out of 5,(12 avis vérifiés),5 out of 5service et produitTrès bon service et produit 17-10-2024par SamirAchat vérifié,5 out of 5j'aimesatisfait25-09-2024par MOHAMEDAchat vérifié,46%Évaluation du vendeur249 AbonnésSuivre,Performance vendeurVitesse d'expédition: BonScore Qualité: Très MauvaisAvis des consommateurs: Moyen
"DELL Optiplex 3020 MT Intel Celeron @ 2.7GHz - RAM 4Go , HDD 500Go (Remis à Neuf)",Marque: DELL ,530.00 Dhs,"1,250.00 Dhs",58%,4 articles seulement,4.2 out of 5,(26 avis vérifiés),5 out of 5meedمليح 16-10-2024par محمدAchat vérifié,5 out of 5bonmabihech ca marche25-09-2024par AbdeljabbarAchat vérifié,74%Évaluation du vendeur788 AbonnésSuivre,Performance vendeurVitesse d'expédition: ExcellentScore Qualité: MauvaisAvis des consommateurs: Bon
DELL Pc OptiPlex i5 4éme Gén 8Go Ram 500Go HDD +  Souris et Clavier - Remis à Neuf,Marque: DELL ,849.00 Dhs,"1,300.00 Dhs",35%,Nan,3.8 out of 5,(25 avis vérifiés),4 out of 5جميلجميل 14-10-2024par يوسفAchat vérifié,5 out of 5zwin 5fif 3la l9alb29-07-2024par HatimAchat vérifié,80%Évaluation du vendeur66 AbonnésSuivre,Performance vendeurVitesse d'expédition: BonScore Qualité: ExcellentAvis des consommateurs: Moyen
Support pour pc portable en aluminium ajustables en 7 positions multifonction,Support pour pc portable en aluminium...,65.99 Dhs,90.00 Dhs,27%,Disponible,4.2 out of 5,(18 avis vérifiés),5 out of 5حي المجد الشيء الذي اعجبني في هذا المنتج هو أنه مصنوع من الحديد و لونه جميل 16-10-2024par HaitamAchat vérifié,5 out of 5جيد للغاية مفيد ومنتج صراحة راءعجيد جدا01-10-2024par ADAMAchat vérifié,86%Évaluation du vendeur160 AbonnésSuivre,Performance vendeurVitesse d'expédition: ExcellentScore Qualité: BonAvis des consommateurs: Bon
"Boutique OfficielleLogitech MK270 Combo Clavier et Souris Sans Fil pour Windows, disposition française, Sans Fil 2,4 GHz, Souris Compacte, 8 Multidispositfs et Raccourcis Touches, Piles 2 Ans, PC et ordinateur portable",Marque: Logitech ,239.00 Dhs,399.00 Dhs,40%,Disponible,4.3 out of 5,(9 avis vérifiés),Nan,Nan,100%Évaluation du vendeur,Nan
mifoy Pack Combo Clavier Gaming + Souris USB M10 RGB Backlighting effect pour PC,Marque: mifoy ,135.00 Dhs,250.00 Dhs,46%,Disponible,3.7 out of 5,(29 avis vérifiés),5 out of 5كأ شي منتوج جميل وتوصيل سريع 27-09-2024par Jihad ElhannaouiAchat vérifié,3 out of 5souris dpi naqsclavier mzian walakin souris dpi mazwinch03-05-2024par nizarAchat vérifié,74%Évaluation du vendeur2161 AbonnésSuivre,Performance vendeurVitesse d'expédition: ExcellentScore Qualité: MoyenAvis des consommateurs: Moyen
"mifoy Souris Gaming M10 Filaire Optique Effet Lumineuse RGB pour PC Portable, Bureau",Marque: mifoy ,29.00 Dhs,95.00 Dhs,69%,Disponible,4 out of 5,(63 avis vérifiés),5 out of 5boutajfifa@gmail.comثمن مناسب و جودة متوسطة13-08-2024par YassineAchat vérifié,"5 out of 5Style Pas chair et efficace 
24-06-2024par Majdi BenajibaAchat vérifié",74%Évaluation du vendeur2161 AbonnésSuivre,Performance vendeurVitesse d'expédition: ExcellentScore Qualité: MoyenAvis des consommateurs: Moyen
Dml Casque Gamer  casque PC avec  son surround casque antibruit avec micro et lumière LED,Marque: Dml ,145.00 Dhs,159.00 Dhs,9%,Nan,4.1 out of 5,(110 avis vérifiés),4 out of 5bonqualité bonne01-10-2024par ImadAchat vérifié,3 out of 5casque daizaKain 7sn sara7a lcable khari ghadi tlwa bzrba ou khass tb9a tl3ab bih Bach tsma305-09-2024par mokAchat vérifié,86%Évaluation du vendeur541 AbonnésSuivre,Performance vendeurVitesse d'expédition: ExcellentScore Qualité: BonAvis des consommateurs: Bon
mifoy Pack Combo Clavier de Jeu + Souris GM100 6 Boutons RGB Capteur Optique DPI LED,Marque: mifoy ,139.00 Dhs,299.00 Dhs,54%,Disponible,4 out of 5,(40 avis vérifiés),"1 out of 5Je n'aime pas ça.Clavier trop petit, Le cable du clavier et de la souris sont trop petit aussi. Le clavier est fragile et d'une mauvaise qualité
Très mauvaise affaire! je regrette acheter ce produit et surtout le clavier. 
Si vous chercher quelque chose de bon, je vous déconseille de prendre ce Pack.
Sur l'image le clavier apparaît grand mais sérieusement c'est le plus petit clavier de toute la planète. Je suis vraiment surpris. ça vaut même pas 20 Dh ce clavier. C'est une arnaque de le vendre à ce prix avec la souris.
La souris devrait être vendu à 50 Dh et le clavier à 20 Dh, le total 70 Dh. 
J'ai un PC Gamer et je ne peux même pas être comfortable avec ces petit cables...c'est vraiment ridicule ce que vous faites.  153 dh le total avec la livraison c'est la honte! La souris est tout à fait normal rien de spécial à part le DPI est élever, mais en général ça ne vaut pas le coup
Je me suis fais arnaquer. La prochaine fois je vais acheter chez Aliexpress au lieu de Jumia, parce que eux en moins ils peuvent me faire un remboursement même si je ne retourne pas la marchandise.25-09-2024par OussamaAchat vérifié",5 out of 5ممتازةالجودة ممتازة11-09-2024par SaadAchat vérifié,74%Évaluation du vendeur2161 AbonnésSuivre,Performance vendeurVitesse d'expédition: ExcellentScore Qualité: MoyenAvis des consommateurs: Moyen
"Boutique OfficielleXIAOMI Mi LCD Writing Tablet 13.5"" - Blanc",Marque: XIAOMI ,170.00 Dhs,290.00 Dhs,41%,Disponible,4.3 out of 5,(49 avis vérifiés),"3 out of 5Cela a bien fonctionné au début et ensuiteAu début, quand j’ai reçu l’appareil, j’appuyais une ou deux fois et il effaçait tout. Après environ un mois d’utilisation normale, je dois appuyer sur la touche d’effacement parfois deux fois et parfois 5 ou 6 fois.

في البداية عندما حصلت على الجهاز لأول مرة، كنت أضغط مرة أو مرتين وسيمحو كل شيء. بعد حوالي شهر واحد من استخدامه بشكل طبيعي، يجب أن أضغط على مفتاح المحو أحيانًا مرتين وأحيانًا 5 أو 6 مرات.11-07-2024par IshaqAchat vérifié","4 out of 5BienBien
02-07-2024par my youssefAchat vérifié",100%Évaluation du vendeur,Nan
"Grand tapis de souris de jeu tapis de souris tapis de clavier, tapis de bureau Gamer, bureau",Les commandes Jumia Express sont éligibles à la livraison gratuite. Offre soumise à conditionsAdieu au temps perdu aux péages. Rechargez votre Pass Jawaz maintenant et gagnez votre temps !,119.00 Dhs,129.00 Dhs,8%,Disponible,4.5 out of 5,(93 avis vérifiés),"5 out of 5it's decentit's perfect, i really love it10-09-2024par HamzaAchat vérifié","5 out of 5worth itVery comfortable, specially in gaming 07-08-2024par MarouaneAchat vérifié",94%Évaluation du vendeur354 AbonnésSuivre,Performance vendeurVitesse d'expédition: ExcellentScore Qualité: ExcellentAvis des consommateurs: Bon
cartable sac a dos swiss gear original,...SAC A DOS,299.00 Dhs,450.00 Dhs,34%,Nan,4.5 out of 5,(37 avis vérifiés),5 out of 5sac a dos suisseTrès bon 17-10-2024par MehdiAchat vérifié,5 out of 5backbagSwisswin Chinese brand vendu en Europe aussi tres bonne qualité  solide essayer le 23-09-2024par RachidAchat vérifié,86%Évaluation du vendeur541 AbonnésSuivre,Performance vendeurVitesse d'expédition: ExcellentScore Qualité: BonAvis des consommateurs: Bon
"Sac pour pc portable, mallette pour pc, cartable, sacoche - 14 POUCES",Les commandes Jumia Express sont éligibles à la livraison gratuite. Offre soumise à conditionsAdieu au temps perdu aux péages. Rechargez votre Pass Jawaz maintenant et gagnez votre temps !,99.00 Dhs,299.00 Dhs,67%,Nan,4 out of 5,(16 avis vérifiés),"4 out of 5un bon rapport qualité/prix5/5 pour le produit ! un bon rapport qualité/prix
3/5 pour la livraison , c'est trop lent! come on!15-08-2024par BadrAchat vérifié","2 out of 5Qualité du produitConcernant le prix original, il correspond pas à la qualité du produit, donc il n'y a pas de réduction06-05-2024par rachidAchat vérifié",80%Évaluation du vendeur52 AbonnésSuivre,Performance vendeurVitesse d'expédition: ExcellentScore Qualité: MoyenAvis des consommateurs: Bon
Adaptateur VGA to HDMI Full HD - Convertisseur VGA vers HDMI,...VGA to HDMI,65.00 Dhs,105.00 Dhs,38%,Disponible,3.8 out of 5,(72 avis vérifiés),"5 out of 5adaptateur vga to hdmiUn très bon câble par rapport à son prix, je suis satisfait de son travail, mais il ne supporte que 60 Hz. En général, on peut lui faire confiance.17-07-2024par AnouarAchat vérifié",5 out of 5bonTrès pratique15-07-2024par Mhammed aliAchat vérifié,86%Évaluation du vendeur541 AbonnésSuivre,Performance vendeurVitesse d'expédition: ExcellentScore Qualité: BonAvis des consommateurs: Bon
TAPIS DE SOURIS NOIR ANTIDÉRAPANTE CARBON,...TAPIS STANDARD,22.00 Dhs,25.00 Dhs,12%,Disponible,4.1 out of 5,(23 avis vérifiés),4 out of 5pas mal Moyen 03-10-2024par OuissaleAchat vérifié,5 out of 5superIl est soft et comme prévu19-04-2024par LouAchat vérifié,86%Évaluation du vendeur160 AbonnésSuivre,Performance vendeurVitesse d'expédition: ExcellentScore Qualité: BonAvis des consommateurs: Bon
