Name,Brand,Price,Old Price,Discount,Stock,Rating,Reviews,First Comment,Second Comment,Seller Info,Seller Performance
"Boutique OfficielleJedel Clavier Mécanique KL-95 à lumière mixte, avec effet de lumière RGB personnalisé",Marque: Jedel ,248.00 Dhs,475.00 Dhs,48%,Nan,4.4 out of 5,(125 avis vérifiés),1 out of 5some of my keybord keys is not woking lsome of my keybord keys is not woking like w and windows i dont know what to do14-10-2024par yassineAchat vérifié,5 out of 5نغمة فيه يا سلامأول مرة نقول عندي كلافيي شي حاجة ناضية بالروجولة28-08-2024par BrahimAchat vérifié,74%Évaluation du vendeur2161 AbonnésSuivre,Performance vendeurVitesse d'expédition: ExcellentScore Qualité: MoyenAvis des consommateurs: Moyen
Boutique OfficielleSH Pack Combo Gaming Clavier + Souris 7D USB RGB,Marque: SH ,175.00 Dhs,399.00 Dhs,56%,Nan,3.9 out of 5,(266 avis vérifiés),3 out of 5ma bihchSaraha clavier 3adia walakine souris chi Haga Nadia mais kathsbiha copie 14-10-2024par WalideAchat vérifié,3 out of 5Pas malPas mal sara7a mais l7rofa makaybanoch fe clavier!05-08-2024par SaadAchat vérifié,74%Évaluation du vendeur2161 AbonnésSuivre,Performance vendeurVitesse d'expédition: ExcellentScore Qualité: MoyenAvis des consommateurs: Moyen
Câble Réseau Ethernet RJ45  CAT6 LAN,0.5M3M5M10M20M30M,25.00 Dhs - 150.00 Dhs,29.00 Dhs - 200.00 Dhs,46%,Disponible,4.5 out of 5,(84 avis vérifiés),5 out of 5goodTested with 50mbps internet and it's very stable30-01-2023par AymaneAchat vérifié,5 out of 5AvantagesRapport qualité prix exelent08-04-2022par Imad eddineAchat vérifié,60%Évaluation du vendeur576 AbonnésSuivre,Performance vendeurVitesse d'expédition: BonScore Qualité: Très MauvaisAvis des consommateurs: Excellent
"Adaptateur HDMI vers VGA 1080P, Convertisseur HDMI Mâle à VGA",...HDMI vers VGA NR,39.99 Dhs,70.00 Dhs,43%,Nan,3.8 out of 5,(27 avis vérifiés),"1 out of 5NoooNe marche pas
19-06-2024par RACHIDAAchat vérifié",4 out of 5bon produitbon produit08-04-2024par ImadAchat vérifié,86%Évaluation du vendeur160 AbonnésSuivre,Performance vendeurVitesse d'expédition: ExcellentScore Qualité: BonAvis des consommateurs: Bon
Câble Adaptateur DP pour Display port mâle vers HDMI Femelle - Noir,Display port vers HDMI Nr...,49.00 Dhs,55.00 Dhs,11%,Nan,3.4 out of 5,(20 avis vérifiés),2 out of 5لالم ينقل الصوت من الحاسب الى التلفاز18-03-2024par NorAchat vérifié,3 out of 5qualité faiblelamcha tatza3za3 rachwiya kaymchi sora22-08-2023par SaadAchat vérifié,86%Évaluation du vendeur541 AbonnésSuivre,Performance vendeurVitesse d'expédition: ExcellentScore Qualité: BonAvis des consommateurs: Bon
"Boutique OfficielleTélécommande C120 Air Mouse 2.4GHz Wireless Mini clavier pour Android,TV,Windows",Les commandes Jumia Express sont éligibles à la livraison gratuite. Offre soumise à conditionsAdieu au temps perdu aux péages. Rechargez votre Pass Jawaz maintenant et gagnez votre temps !,61.10 Dhs,199.00 Dhs,69%,2 articles seulement,3.8 out of 5,(100 avis vérifiés),5 out of 5Adel Alemdarلم أجربه بعد لكنه منتج جيد و رائع15-10-2024par AdelAchat vérifié,5 out of 5télécommande C'est du jamais vu. Meilleur télécommande. 06-09-2024par DrissAchat vérifié,80%Évaluation du vendeur545 AbonnésSuivre,Performance vendeurVitesse d'expédition: BonScore Qualité: ExcellentAvis des consommateurs: Moyen
Boutique OfficielleSony Casque ZX110 Avec Fil Noir (MDRZX110APBC1E),Marque: Sony ,169.00 Dhs,200.00 Dhs,16%,Nan,4.7 out of 5,(3 avis vérifiés),Nan,Nan,94%Évaluation du vendeur67 AbonnésSuivre,Performance vendeurVitesse d'expédition: ExcellentScore Qualité: BonAvis des consommateurs: Excellent
WDLINK Imprimante thermique Ticket 80mm Original,Marque: WDLINK ,789.99 Dhs,"1,000.00 Dhs",21%,Nan,4.7 out of 5,(7 avis vérifiés),"5 out of 5Bon articleÇa fait des impressions de Bonne qualité, j'aime bien je suis satistait23-09-2024par AnouarAchat vérifié",5 out of 5TOPTrès bon produit 100%23-09-2024par AliAchat vérifié,80%Évaluation du vendeur210 AbonnésSuivre,Performance vendeurVitesse d'expédition: ExcellentScore Qualité: MoyenAvis des consommateurs: Bon
Boutique OfficielleJabra Evolve 20 MS Stéréo Micro-casque filaire stéréo optimisé Lync,Marque: Jabra ,423.00 Dhs,490.00 Dhs,14%,Disponible,4.5 out of 5,(17 avis vérifiés),5 out of 5superTrès bonne qualité 15-04-2024par IssamAchat vérifié,"5 out of 5ممتازجودة الصوت والميكروفون مزيانة.
يستحق 5 نجمات14-03-2024par AbdelaaliAchat vérifié",80%Évaluation du vendeur549 AbonnésSuivre,Performance vendeurVitesse d'expédition: BonScore Qualité: BonAvis des consommateurs: Bon
Royal JR 67 Souris de jeu a fil gaming Pro RGB LED 6400 Dpi Shifting 7boutons,Marque: Royal ,135.00 Dhs,250.00 Dhs,46%,Disponible,3.7 out of 5,(71 avis vérifiés),5 out of 5naadiakhfifa o lrgb nadi walakin la kano idik sghar ma tkhdhach23-09-2024par aliAchat vérifié,"5 out of 5superTrès bon article, mon fils est très satisfait 

04-09-2024par NawalAchat vérifié",74%Évaluation du vendeur2161 AbonnésSuivre,Performance vendeurVitesse d'expédition: ExcellentScore Qualité: MoyenAvis des consommateurs: Moyen
Hp CARTOUCHE 305 NOIR,Marque: Hp ,178.50 Dhs,178.50 Dhs,0,4 articles seulement,4.2 out of 5,(9 avis vérifiés),5 out of 5conformeProduit conforme et livraison rapide 18-10-2024par acheteurAchat vérifié,5 out of 5works as supposed toWorks26-08-2024par SamyAchat vérifié,80%Évaluation du vendeur68 AbonnésSuivre,Performance vendeurVitesse d'expédition: BonScore Qualité: BonAvis des consommateurs: Bon
"Boutique OfficielleSH MK-X60 Clavier Gamer mécanique BLUE SWITCH 87 touches, rétro-éclairage RGB",Marque: SH ,389.00 Dhs,550.00 Dhs,29%,7 articles seulement,4.2 out of 5,(172 avis vérifiés),"5 out of 5clavier zwinaZwina mn na7iyya katji n9iyya o mzyana flle3b
05-08-2024par AdamAchat vérifié",5 out of 5Incroyable Trop trop bien vraiment 08-07-2024par SALAH FARESSAchat vérifié,74%Évaluation du vendeur2161 AbonnésSuivre,Performance vendeurVitesse d'expédition: ExcellentScore Qualité: MoyenAvis des consommateurs: Moyen
"Mini clavier et souris sans fil Bluetooth pour PC, ipad, téléphone, tablette",Les commandes Jumia Express sont éligibles à la livraison gratuite. Offre soumise à conditionsAdieu au temps perdu aux péages. Rechargez votre Pass Jawaz maintenant et gagnez votre temps !,179.00 Dhs,264.00 Dhs,32%,Disponible,3.9 out of 5,(17 avis vérifiés),5 out of 5j'aime bcq caj'ai vraiment aimer ce produit bon prix avec une très bonne qualité16-07-2024par SAADAchat vérifié,2 out of 5Poor keyboard battery The keyboard battery doesn’t last few hours the only good thing is the mouse19-04-2024par Abdessamad ChroukiAchat vérifié,74%Évaluation du vendeur2161 AbonnésSuivre,Performance vendeurVitesse d'expédition: ExcellentScore Qualité: MoyenAvis des consommateurs: Moyen
DELL Chargeur  Pc Portable Original 19.5V / 6.7A / 130W  Adaptateur AC - LA130PM121,Marque: DELL ,149.00 Dhs,227.00 Dhs,34%,Disponible,4.8 out of 5,(15 avis vérifiés),4 out of 5fonctionne bienBien07-09-2023par rachidAchat vérifié,5 out of 5AppréciationBonne qualité et livraison rapide26-06-2023par YounesAchat vérifié,74%Évaluation du vendeur788 AbonnésSuivre,Performance vendeurVitesse d'expédition: ExcellentScore Qualité: MauvaisAvis des consommateurs: Bon
Boutique OfficielleLenovo PC PORTABLE  Thinkpad-T460 Core i5 RAM 8GB 500 HDD-6ème Génération-Remis a Neuf,Marque: Lenovo ,"1,999.00 Dhs","4,999.00 Dhs",60%,Disponible,3.6 out of 5,(23 avis vérifiés),Nan,Nan,46%Évaluation du vendeur249 AbonnésSuivre,Performance vendeurVitesse d'expédition: BonScore Qualité: Très MauvaisAvis des consommateurs: Moyen
"Boutique OfficielleApple Macbook Pro Retina 13,3"" -2015 -INTEL CORE i5-RAM 8Go-SSD 128Go - Remis a neuf",Marque: Apple ,"3,399.00 Dhs","4,199.00 Dhs",19%,9 articles seulement,5 out of 5,(2 avis vérifiés),Nan,Nan,46%Évaluation du vendeur249 AbonnésSuivre,Performance vendeurVitesse d'expédition: BonScore Qualité: Très MauvaisAvis des consommateurs: Moyen
"Hp EliteBook 850 G5 - Intel Core i5-8365U -16GB RAM- 256GB NVMe 15.6""- Remis a neuf",Marque: Hp ,"3,150.00 Dhs","4,200.00 Dhs",25%,Nan,0 out of 5,(Pas d'avis disponibles),Nan,Nan,66%Évaluation du vendeur830 AbonnésSuivre,Performance vendeurVitesse d'expédition: ExcellentScore Qualité: MauvaisAvis des consommateurs: Moyen
"Boutique OfficielleHp PC Portable Probook 640 Core intel i3-500Go-RAM 8GB 14""- remis a neuf",Marque: Hp ,"3,699.00 Dhs","4,299.00 Dhs",14%,Disponible,4.2 out of 5,(5 avis vérifiés),Nan,Nan,46%Évaluation du vendeur249 AbonnésSuivre,Performance vendeurVitesse d'expédition: BonScore Qualité: Très MauvaisAvis des consommateurs: Moyen
Boutique OfficielleLenovo PC PORTABLE LENOVO THINKPAD T540P-I5-8G-500Go-FULL HD-REMISE A NEUF,Marque: Lenovo ,"2,999.00 Dhs","3,899.00 Dhs",23%,8 articles seulement,3.7 out of 5,(15 avis vérifiés),"3 out of 5Bonne moyenneL'ordinateur est bon, mais son état extérieur est de 1 sur dix, mauvais, sale   beaucoup rayé à l'extérieur   l'emballage était bon et le personnel de livraison était bon23-09-2024par Jamila El jalouliAchat vérifié",2 out of 5hajardika123@gmail.comLes pc sont de mauvaises qualités l affiche du pc Lenovo thinkpad est trompeuse il faut mentionner que ces pc sont 4 generation 22-05-2024par hajardika123@gmail.comAchat vérifié,46%Évaluation du vendeur249 AbonnésSuivre,Performance vendeurVitesse d'expédition: BonScore Qualité: Très MauvaisAvis des consommateurs: Moyen
Boutique OfficielleHp PC Portable ELITEBOOK X360 G2 I5-7éme -8GB- 256GB SSD - TACTILE -REMIS À NEUF,Marque: Hp ,"4,549.00 Dhs","7,999.00 Dhs",43%,6 articles seulement,0 out of 5,(Pas d'avis disponibles),Nan,Nan,46%Évaluation du vendeur249 AbonnésSuivre,Performance vendeurVitesse d'expédition: BonScore Qualité: Très MauvaisAvis des consommateurs: Moyen
Hp EliteBook 840 14Pouce G3 Core i5 6eme Grd 8Go DDR4-256 M.2 SSD Remis a Neuf,Marque: Hp ,"2,550.00 Dhs","7,500.00 Dhs",66%,4 articles seulement,4.2 out of 5,(13 avis vérifiés),5 out of 5شكر للبائعصراحة إنه منتوج رائع  ويستحق أكثر من خمس نجوم والشكر الجزيل للبائع ول لموظفي جوميا الأوفياء. 29-04-2024par AbdelazizAchat vérifié,5 out of 5حاسوب مزيانتحلف عليه جديد تبارك الله عليكم15-04-2024par LamiaAchat vérifié,74%Évaluation du vendeur143 AbonnésSuivre,Performance vendeurVitesse d'expédition: BonScore Qualité: ExcellentAvis des consommateurs: Mauvais
Boutique OfficielleLenovo PC PORTABLE  Thinkpad-L430 Core i5-5éme Génération-RAM-8GB-500 HDD-AZERTY-Remis a Neuf,Marque: Lenovo ,"1,679.00 Dhs","2,399.00 Dhs",30%,Nan,0 out of 5,(Pas d'avis disponibles),Nan,Nan,46%Évaluation du vendeur249 AbonnésSuivre,Performance vendeurVitesse d'expédition: BonScore Qualité: Très MauvaisAvis des consommateurs: Moyen
Mini Clavier sans Fil 2.4GHz pavé numérique 18 Touches Compatible PC et Mac,Les commandes Jumia Express sont éligibles à la livraison gratuite. Offre soumise à conditionsAdieu au temps perdu aux péages. Rechargez votre Pass Jawaz maintenant et gagnez votre temps !,95.00 Dhs,165.00 Dhs,42%,Disponible,4.7 out of 5,(3 avis vérifiés),Nan,Nan,74%Évaluation du vendeur2161 AbonnésSuivre,Performance vendeurVitesse d'expédition: ExcellentScore Qualité: MoyenAvis des consommateurs: Moyen
Jedel Casque Gamer  casque PC avec  son surround antibruit avec micro et lumière RGB GH-253 sticker,Marque: Jedel ,119.00 Dhs,159.00 Dhs,25%,Nan,2.5 out of 5,(2 avis vérifiés),Nan,Nan,94%Évaluation du vendeur354 AbonnésSuivre,Performance vendeurVitesse d'expédition: ExcellentScore Qualité: ExcellentAvis des consommateurs: Bon
"Toshiba Disque dur externe HDD 320Go - 2.5"" - SATA 6GB/S - 7200 RPM 32Mo",Marque: Toshiba ,149.00 Dhs,599.00 Dhs,75%,Nan,0 out of 5,(Pas d'avis disponibles),Nan,Nan,74%Évaluation du vendeur788 AbonnésSuivre,Performance vendeurVitesse d'expédition: ExcellentScore Qualité: MauvaisAvis des consommateurs: Bon
Boutique OfficielleDELL Optiplex 3020 SFF Intel G1840 RAM 8Go HDD 500Go- WIFI-Remis à Neuf,Marque: DELL ,699.00 Dhs,"1,399.00 Dhs",50%,Nan,3.7 out of 5,(3 avis vérifiés),"1 out of 5مزيان وخا خاسرة ليه الديسك ديسميت
17-10-2024par SebbarhAchat vérifié","5 out of 5bien articleBien article

Gooooood article


16-10-2024par AdnaneAchat vérifié",66%Évaluation du vendeur388 AbonnésSuivre,Performance vendeurVitesse d'expédition: BonScore Qualité: MoyenAvis des consommateurs: Moyen
Adaptateur multiport 4-IN-1 Hub Type-C vers HD VGA,...multiport 4-IN-1 Hub Type-C,129.00 Dhs,165.00 Dhs,22%,Nan,4.2 out of 5,(10 avis vérifiés),5 out of 5Mon avisTrès utile pour les les nouveaux macbook.03-07-2023par AbderahimAchat vérifié,2 out of 5متوسطمتوسط..10-05-2022par MOHAMEDAchat vérifié,86%Évaluation du vendeur541 AbonnésSuivre,Performance vendeurVitesse d'expédition: ExcellentScore Qualité: BonAvis des consommateurs: Bon
Table Laptop Ajustable T8 Avec Ventilation Refroidissement 360° +support souris,...TABLE Z,188.00 Dhs,250.00 Dhs,25%,Nan,3.8 out of 5,(6 avis vérifiés),Nan,Nan,86%Évaluation du vendeur541 AbonnésSuivre,Performance vendeurVitesse d'expédition: ExcellentScore Qualité: BonAvis des consommateurs: Bon
"Adaptateur DVI HDMI, Connecteur DVI D 24+1 Mâle vers HDMI Femelle Support 1080P",DVI TO HDMI,29.00 Dhs,45.00 Dhs,36%,Nan,4.1 out of 5,(34 avis vérifiés),5 out of 5okArticle satisfaisant 27-06-2024par ahmedAchat vérifié,5 out of 5azizBon produit07-02-2023par AzizAchat vérifié,86%Évaluation du vendeur160 AbonnésSuivre,Performance vendeurVitesse d'expédition: ExcellentScore Qualité: BonAvis des consommateurs: Bon
"Kingston Originale SSD 480GB (2.5""SATA 3) améliore et réactivité du système transferts fichiers plus rapide",Marque: Kingston ,485.00 Dhs,599.00 Dhs,19%,Nan,4.8 out of 5,(27 avis vérifiés),"5 out of 5ExcellentTrès performant rapide et puissant
09-10-2024par SALIMAchat vérifié","5 out of 5Rapport qualité/prix imbattableLivraison le lendemain de la commande, produit conforme à la description. Installé et marche parfaitement avec un temps d'accès rapide.05-07-2024par CHIHABAchat vérifié",86%Évaluation du vendeur541 AbonnésSuivre,Performance vendeurVitesse d'expédition: ExcellentScore Qualité: BonAvis des consommateurs: Bon
"Philips Écran LED 17'' 17S1SB - 1280 x 1024 à 60 Hz - 5ms - DVI-D, VGA - Remis à Neuf",Marque: Philips ,349.00 Dhs,479.00 Dhs,27%,3 articles seulement,4.8 out of 5,(4 avis vérifiés),Nan,Nan,74%Évaluation du vendeur788 AbonnésSuivre,Performance vendeurVitesse d'expédition: ExcellentScore Qualité: MauvaisAvis des consommateurs: Bon
KIOXIA Clé Usb 2.0 Capacité 32Gb Flash Drive // Stockage 32g DataTraveler TransMemory,Marque: KIOXIA ,59.00 Dhs,59.00 Dhs,0,4 articles seulement,4.1 out of 5,(17 avis vérifiés),2 out of 5C'est ok!28g et non 3209-04-2024par GhizlaneAchat vérifié,1 out of 5Transfert hyper lentMet des heures à transférer les fichiers01-03-2024par YassinAchat vérifié,74%Évaluation du vendeur24 AbonnésSuivre,Performance vendeurVitesse d'expédition: ExcellentScore Qualité: MauvaisAvis des consommateurs: Bon
Epson EcoTank L3250 Imprimante WiFi multifonction à réservoirs rechargeables,Marque: Epson ,"1,875.00 Dhs","2,500.00 Dhs",25%,Nan,3.8 out of 5,(15 avis vérifiés),Nan,Nan,66%Évaluation du vendeur203 AbonnésSuivre,Performance vendeurVitesse d'expédition: BonScore Qualité: MoyenAvis des consommateurs: Moyen
"Imice Souris Gaming Optique 8 Boutons LED 7200 DPI avec Câble USB 1,8 m pour PC - Noir",Marque: Imice ,95.00 Dhs,223.00 Dhs,57%,Disponible,3.8 out of 5,(5 avis vérifiés),Nan,Nan,74%Évaluation du vendeur2161 AbonnésSuivre,Performance vendeurVitesse d'expédition: ExcellentScore Qualité: MoyenAvis des consommateurs: Moyen
Hp DeskTop - Core I5-4590 ( 3.3 Ghz ) 16GB Ram + 256GB SSD + 500GB HDD Remis à neuf,Marque: Hp ,"1,380.00 Dhs","2,500.00 Dhs",45%,Nan,3.2 out of 5,(5 avis vérifiés),1 out of 5Taman ghali mo9arana m3a configMachi chi haja04-08-2023par XxxxAchat vérifié,3 out of 5adam bilalخلف بالوعد03-07-2023par AdamAchat vérifié,80%Évaluation du vendeur66 AbonnésSuivre,Performance vendeurVitesse d'expédition: BonScore Qualité: ExcellentAvis des consommateurs: Moyen
Epson EcoTank L3250 Imprimante WiFi multifonction à réservoirs rechargeables,Marque: Epson ,"1,799.00 Dhs","2,390.00 Dhs",25%,Nan,5 out of 5,(2 avis vérifiés),Nan,Nan,86%Évaluation du vendeur11 AbonnésSuivre,Performance vendeurVitesse d'expédition: MoyenScore Qualité: ExcellentAvis des consommateurs: Excellent
Kingston Clé USB - 128GB - USB Pour Stockage - USB 3.2 - DataTraveler EXODIA,Marque: Kingston ,139.00 Dhs,170.00 Dhs,18%,Nan,4.2 out of 5,(41 avis vérifiés),"5 out of 5Trés bienTrès bien 
Fonctionne 100% normal15-02-2024par anonymeAchat vérifié",4 out of 5ParfaitClé original vérifier27-12-2022par SoufianeAchat vérifié,86%Évaluation du vendeur541 AbonnésSuivre,Performance vendeurVitesse d'expédition: ExcellentScore Qualité: BonAvis des consommateurs: Bon
Sac pc portable mallette portable cartable sacoche 14inch,Les commandes Jumia Express sont éligibles à la livraison gratuite. Offre soumise à conditionsAdieu au temps perdu aux péages. Rechargez votre Pass Jawaz maintenant et gagnez votre temps !,99.00 Dhs,199.00 Dhs,50%,Nan,2 out of 5,(1 avis vérifié),Nan,Nan,80%Évaluation du vendeur38 AbonnésSuivre,Performance vendeurVitesse d'expédition: BonScore Qualité: ExcellentAvis des consommateurs: Moyen
Hp PC PORTABLE ELITEBOOK 840 G5 8ÉME GÉN-CORE I5-8Go-256 Go SSD-Remis à neuf,Marque: Hp ,"3,150.00 Dhs","5,000.00 Dhs",37%,6 articles seulement,4.8 out of 5,(6 avis vérifiés),"5 out of 5pc hp Bon produit ,bonne qualité prix 28-08-2024par aminaAchat vérifié",5 out of 5je recommande le vendeurje recommande le vendeur10-07-2024par NADIAAchat vérifié,66%Évaluation du vendeur830 AbonnésSuivre,Performance vendeurVitesse d'expédition: ExcellentScore Qualité: MauvaisAvis des consommateurs: Moyen
Canon Pack Cartouches 445 Noir + 446 Couleur,Marque: Canon ,529.00 Dhs,529.00 Dhs,0,2 articles seulement,0 out of 5,(Pas d'avis disponibles),Nan,Nan,100%Évaluation du vendeur58 AbonnésSuivre,Performance vendeurVitesse d'expédition: ExcellentScore Qualité: ExcellentAvis des consommateurs: Excellent
Verbatim Clé Usb 2.0 Capacité 32Gb Flash Drive // Stockage 32g DataTraveler,Marque: Verbatim ,49.00 Dhs,49.00 Dhs,0,1 articles seulement,4.3 out of 5,(11 avis vérifiés),4 out of 5bienTrès bien. 03-09-2024par TARIKAchat vérifié,4 out of 5passableSauf que c'est 28 go pas 32go01-07-2024par MehdiAchat vérifié,74%Évaluation du vendeur24 AbonnésSuivre,Performance vendeurVitesse d'expédition: ExcellentScore Qualité: MauvaisAvis des consommateurs: Bon
"Adaptateur multi-répartiteur USB C, HUB 3.0, Type C 3.1, 4 ports",Les commandes Jumia Express sont éligibles à la livraison gratuite. Offre soumise à conditionsAdieu au temps perdu aux péages. Rechargez votre Pass Jawaz maintenant et gagnez votre temps !,79.00 Dhs,90.00 Dhs,12%,Nan,5 out of 5,(1 avis vérifié),Nan,Nan,74%Évaluation du vendeur177 AbonnésSuivre,Performance vendeurVitesse d'expédition: ExcellentScore Qualité: MoyenAvis des consommateurs: Moyen
Nettoyant pour écran de téléphone / pc / TV / toutes les électroniques 200ML,Les commandes Jumia Express sont éligibles à la livraison gratuite. Offre soumise à conditionsAdieu au temps perdu aux péages. Rechargez votre Pass Jawaz maintenant et gagnez votre temps !,82.00 Dhs,99.00 Dhs,17%,Nan,5 out of 5,(3 avis vérifiés),Nan,Nan,86%Évaluation du vendeur36 AbonnésSuivre,Performance vendeurVitesse d'expédition: ExcellentScore Qualité: ExcellentAvis des consommateurs: Moyen
Boutique OfficielleCanon Imprimante Pixma MegaTanK G3430 multifonction à réservoirs rechargeables,Marque: Canon ,"1,599.00 Dhs","2,500.00 Dhs",36%,2 articles seulement,0 out of 5,(Pas d'avis disponibles),Nan,Nan,94%Évaluation du vendeur67 AbonnésSuivre,Performance vendeurVitesse d'expédition: ExcellentScore Qualité: BonAvis des consommateurs: Excellent
Boutique OfficielleCanon PIXMA G2430 Imprimante multifonction à réservoirs rechargeables (5991C009AA),Marque: Canon ,"1,279.00 Dhs","1,590.00 Dhs",20%,5 articles seulement,4 out of 5,(3 avis vérifiés),Nan,Nan,94%Évaluation du vendeur67 AbonnésSuivre,Performance vendeurVitesse d'expédition: ExcellentScore Qualité: BonAvis des consommateurs: Excellent
Jabra CASQUE EVOLVE 20 Duo,Marque: Jabra ,480.00 Dhs,750.00 Dhs,36%,3 articles seulement,4.6 out of 5,(9 avis vérifiés),"5 out of 5Bon état, merciBon état, merci29-12-2023par SoulaimanAchat vérifié",5 out of 5tres bienDe bonne qualité 09-11-2023par PaulineAchat vérifié,86%Évaluation du vendeur157 AbonnésSuivre,Performance vendeurVitesse d'expédition: ExcellentScore Qualité: ExcellentAvis des consommateurs: Moyen
Hp ELITEBOOK 840 G1 CORE I5-4300U 4EME GÉNÉRATION - 8GB / 256GB SSD AZERTY (Remis à Neuf),Marque: Hp ,"1,850.00 Dhs","3,999.00 Dhs",54%,2 articles seulement,5 out of 5,(1 avis vérifié),Nan,Nan,74%Évaluation du vendeur788 AbonnésSuivre,Performance vendeurVitesse d'expédition: ExcellentScore Qualité: MauvaisAvis des consommateurs: Bon
Boutique OfficielleLenovo Chargeur Pc Portable USB Original 45W / 20V / 2.25A - Adaptateur AC -ADLX45DLC3A,Marque: Lenovo ,115.00 Dhs,227.00 Dhs,49%,4 articles seulement,4.3 out of 5,(13 avis vérifiés),5 out of 5jaime cabonne qualité11-07-2024par LiliaAchat vérifié,5 out of 5works for x270 tooworks for x270 too10-06-2024par ZinebAchat vérifié,74%Évaluation du vendeur788 AbonnésSuivre,Performance vendeurVitesse d'expédition: ExcellentScore Qualité: MauvaisAvis des consommateurs: Bon
Razer Tapis de souris Plexus 900 x 300 MM Tapis gamer souris et clavier Gaming Mouse Pad,Marque: Razer ,89.00 Dhs,99.00 Dhs,10%,Disponible,4.3 out of 5,(20 avis vérifiés),Nan,Nan,94%Évaluation du vendeur354 AbonnésSuivre,Performance vendeurVitesse d'expédition: ExcellentScore Qualité: ExcellentAvis des consommateurs: Bon
Boutique OfficielleDELL Pc Gamer Core i5 - 4th Gén -16Go DDR3 - 256Go SSD + 1To HDD - AMD FirePro (Remis à Neuf),Marque: DELL ,"1,999.00 Dhs","3,359.00 Dhs",40%,9 articles seulement,3.2 out of 5,(22 avis vérifiés),4 out of 5youseffaycal23@gmail.comهو زوين الى بغيتي تبدا بيه27-09-2024par carlosAchat vérifié,3 out of 5BienHouwa pc zwin dyal lkhdma walakin majanich m3ah lcasque 06-06-2024par ILYAS BOUHASSANAAchat vérifié,74%Évaluation du vendeur788 AbonnésSuivre,Performance vendeurVitesse d'expédition: ExcellentScore Qualité: MauvaisAvis des consommateurs: Bon
Boutique OfficielleRazer Souris DeathAdder Essential,Marque: Razer ,389.99 Dhs,700.00 Dhs,44%,Nan,4.7 out of 5,(61 avis vérifiés),5 out of 5goodkhdama biha mn chhal mtelecharjia logiciel w kulchi ta serial number khdem lia f site razer01-07-2024par Maryem SabriAchat vérifié,5 out of 5Bonne produitI love this product soo much that was a high quality razer product thank you !19-02-2024par TryhardAchat vérifié,54%Évaluation du vendeur3094 AbonnésSuivre,Performance vendeurVitesse d'expédition: ExcellentScore Qualité: Très MauvaisAvis des consommateurs: Moyen
Casque Gaming Stéréo LED Gt 85 Filaire E-sports avec Microphone Entouré HiFi,Les commandes Jumia Express sont éligibles à la livraison gratuite. Offre soumise à conditionsAdieu au temps perdu aux péages. Rechargez votre Pass Jawaz maintenant et gagnez votre temps !,119.00 Dhs,459.00 Dhs,74%,Disponible,4 out of 5,(2 avis vérifiés),Nan,Nan,74%Évaluation du vendeur2161 AbonnésSuivre,Performance vendeurVitesse d'expédition: ExcellentScore Qualité: MoyenAvis des consommateurs: Moyen
"Boutique OfficielleHp Pack cartouche 305 Noir + 305 Couleur Pour Deskjet 2710, 2720 ( Cadeau offert )",Marque: Hp ,399.00 Dhs,550.00 Dhs,27%,2 articles seulement,4.9 out of 5,(9 avis vérifiés),Nan,Nan,80%Évaluation du vendeur64 AbonnésSuivre,Performance vendeurVitesse d'expédition: BonScore Qualité: ExcellentAvis des consommateurs: Moyen
"WD Disque Dur Interne 500GB / 500GO Western Digital SATA HDD 3.5""",Marque: WD ,199.00 Dhs,350.00 Dhs,43%,5 articles seulement,3.7 out of 5,(3 avis vérifiés),Nan,Nan,94%Évaluation du vendeur189 AbonnésSuivre,Performance vendeurVitesse d'expédition: BonScore Qualité: ExcellentAvis des consommateurs: Excellent
Boutique OfficielleLenovo PC PORTABLE THINKPAD T540P-I5-8G-256Go SSD-FULL HD-REMIS A NEUF,Marque: Lenovo ,"3,199.00 Dhs","3,599.00 Dhs",11%,Disponible,4 out of 5,(2 avis vérifiés),Nan,Nan,66%Évaluation du vendeur388 AbonnésSuivre,Performance vendeurVitesse d'expédition: BonScore Qualité: MoyenAvis des consommateurs: Moyen
sacoche Housse pour pc portable protection portable 2 fermetures à glissière 15p,15pouce,117.00 Dhs,169.00 Dhs,31%,Nan,5 out of 5,(1 avis vérifié),Nan,Nan,86%Évaluation du vendeur61 AbonnésSuivre,Performance vendeurVitesse d'expédition: ExcellentScore Qualité: ExcellentAvis des consommateurs: Moyen
