Name,Brand,Price,Old Price,Discount,Stock,Rating,Reviews,First Comment,Second Comment,Seller Info,Seller Performance
Kingston DataTraveler Exodia DTX 32GB Clé USB 3.2 - capuchon et anneaux pour porte-clés,Marque: Kingston ,59.50 Dhs,99.00 Dhs,40%,Nan,4.1 out of 5,(26 avis vérifiés),1 out of 5Jaime pasCe nest qune carte memoire. Machi chi 7aaaja a drari09-09-2024par AnassAchat vérifié,5 out of 5produit de bonne qualiteFiable et pratique20-11-2023par youssefAchat vérifié,86%Évaluation du vendeur541 AbonnésSuivre,Performance vendeurVitesse d'expédition: ExcellentScore Qualité: BonAvis des consommateurs: Bon
Samsung RAM 16GB DDR4 PC4-21300 DDR4-2666 MHz Pour Ordinateur Portable Mémoire Vive RAM,Marque: Samsung ,390.00 Dhs,450.00 Dhs,13%,4 articles seulement,4.9 out of 5,(7 avis vérifiés),"5 out of 5Salute Working as intended 
13-09-2024par Younes FaizAchat vérifié",5 out of 5Remerciement ce produit est vraiment impeccable merci bcp 05-06-2024par Anonyme Achat vérifié,74%Évaluation du vendeur161 AbonnésSuivre,Performance vendeurVitesse d'expédition: ExcellentScore Qualité: MauvaisAvis des consommateurs: Bon
Hp Chargeur ORIGINAL 19.5 V 2.31 A 45 W Bleu Pointe ( Origine ),Marque: Hp ,160.00 Dhs,220.00 Dhs,27%,Disponible,5 out of 5,(2 avis vérifiés),Nan,Nan,66%Évaluation du vendeur830 AbonnésSuivre,Performance vendeurVitesse d'expédition: ExcellentScore Qualité: MauvaisAvis des consommateurs: Moyen
Câble de chargement rapide Type C,Les commandes Jumia Express sont éligibles à la livraison gratuite. Offre soumise à conditionsAdieu au temps perdu aux péages. Rechargez votre Pass Jawaz maintenant et gagnez votre temps !,28.99 Dhs,28.99 Dhs,0,Disponible,4.2 out of 5,(5 avis vérifiés),5 out of 5bienBonne qualité merci jumia16-05-2022par nadiaAchat vérifié,"5 out of 5Câble chargeur.Ces cables,actifs,effecaces(type c).19-11-2021par hassanAchat vérifié",60%Évaluation du vendeur90 AbonnésSuivre,Performance vendeurVitesse d'expédition: ExcellentScore Qualité: Très MauvaisAvis des consommateurs: Moyen
Hp Imprimante à Rèservoires Tout-en-un Smart Tank 516 - 22 PPM,Marque: Hp ,"1,399.00 Dhs","2,800.00 Dhs",50%,Nan,4 out of 5,(1 avis vérifié),Nan,Nan,80%Évaluation du vendeur64 AbonnésSuivre,Performance vendeurVitesse d'expédition: BonScore Qualité: ExcellentAvis des consommateurs: Moyen
Nouveau mini Clavier et Souris Sans Fil Bluetooth USB,Starexpress.ma,149.00 Dhs,180.00 Dhs,17%,6 articles seulement,4.5 out of 5,(4 avis vérifiés),Nan,Nan,74%Évaluation du vendeur177 AbonnésSuivre,Performance vendeurVitesse d'expédition: ExcellentScore Qualité: MoyenAvis des consommateurs: Moyen
Toshiba Disque dur externe USB 3.0 canvio ready 1TB Noir,Marque: Toshiba ,599.00 Dhs,"1,090.00 Dhs",45%,Disponible,4.3 out of 5,(4 avis vérifiés),2 out of 5pas neufHdd Deja utilise19-08-2024par Si MohamedAchat vérifié,"5 out of 5TOPGOOD , thanks06-08-2024par MEHDIAchat vérifié",60%Évaluation du vendeur576 AbonnésSuivre,Performance vendeurVitesse d'expédition: BonScore Qualité: Très MauvaisAvis des consommateurs: Excellent
Hub 4 Port USB 3.0,Marque: Hub ,55.00 Dhs,65.00 Dhs,15%,Nan,4 out of 5,(21 avis vérifiés),5 out of 5tres bon produit Très bon produit 20-05-2024par NadiaAchat vérifié,5 out of 5tres bienA mon avis c'est le meilleur USB hub que j'ai acheté maintenanat j'ai acheté 3 usb hub le seul qui est solide et fonctionnel est celui la j'ai juste une suggestion que 4 ports USB ne sont pas suffisant pour des gamer comme moi10-06-2022par RayanAchat vérifié,86%Évaluation du vendeur541 AbonnésSuivre,Performance vendeurVitesse d'expédition: ExcellentScore Qualité: BonAvis des consommateurs: Bon
NEW WORD Pack Bouteilles d'encre GI-490 pour les imprimantes à réservoirs PIXMA G3411/...,Marque: NEW WORD ,185.00 Dhs,185.00 Dhs,0,8 articles seulement,5 out of 5,(1 avis vérifié),Nan,Nan,80%Évaluation du vendeur68 AbonnésSuivre,Performance vendeurVitesse d'expédition: BonScore Qualité: BonAvis des consommateurs: Bon
Foxconn Câble Original pour iPhone Lightning vers USB pour iPhone,Marque: Foxconn ,39.00 Dhs,59.00 Dhs,34%,Nan,4.6 out of 5,(5 avis vérifiés),Nan,Nan,74%Évaluation du vendeur177 AbonnésSuivre,Performance vendeurVitesse d'expédition: ExcellentScore Qualité: MoyenAvis des consommateurs: Moyen
Canon IMPRIMANTE JET D'ENCRE COULEUR PIXMA MG2540S 3EN1:IMPRESSION/SCAN/COPIE,Marque: Canon ,499.00 Dhs,750.00 Dhs,33%,5 articles seulement,4.3 out of 5,(4 avis vérifiés),4 out of 5J'aimeBonne qualité30-07-2021par HamzaAchat vérifié,5 out of 5rsuythanks02-02-2021par NaimaAchat vérifié,86%Évaluation du vendeur261 AbonnésSuivre,Performance vendeurVitesse d'expédition: BonScore Qualité: ExcellentAvis des consommateurs: Bon
Lenovo 15.6 Laptop Casual Toploader T210 - Cartable Lenovo 15.6,Marque: Lenovo ,185.00 Dhs,499.00 Dhs,63%,Nan,4.7 out of 5,(6 avis vérifiés),"5 out of 5GoodI really like it, reasonable price and good quality13-08-2024par chAchat vérifié",5 out of 5رائعةتستحق الشراء29-07-2024par IbrahimAchat vérifié,74%Évaluation du vendeur186 AbonnésSuivre,Performance vendeurVitesse d'expédition: MoyenScore Qualité: ExcellentAvis des consommateurs: Moyen
"Adaptateur USB Type-C 8 in 1 HDMI 4K, USB 3.0 USB 2.0, LAN Rj45 Type-C,SD TF",Les commandes Jumia Express sont éligibles à la livraison gratuite. Offre soumise à conditionsAdieu au temps perdu aux péages. Rechargez votre Pass Jawaz maintenant et gagnez votre temps !,250.00 Dhs,300.00 Dhs,17%,2 articles seulement,3.5 out of 5,(2 avis vérifiés),Nan,Nan,74%Évaluation du vendeur50 AbonnésSuivre,Performance vendeurVitesse d'expédition: ExcellentScore Qualité: MoyenAvis des consommateurs: Moyen
Hp PC PORTABLE Slim  CORE i5 6eme RAM 8Go DDR4 - HDD 500Go -Remis a Neuf,Marque: Hp ,"2,290.00 Dhs","5,400.00 Dhs",58%,Disponible,3.4 out of 5,(14 avis vérifiés),5 out of 5J'ai aiméLes caractéristiques techniques mentionnés sont conformes au produit livré.11-04-2022par Koffi ValeryAchat vérifié,2 out of 5مراكشبخفض سعر المنتج لأنه لايرقى إلى درجة سعره.09-03-2022par OumaAchat vérifié,74%Évaluation du vendeur161 AbonnésSuivre,Performance vendeurVitesse d'expédition: ExcellentScore Qualité: MauvaisAvis des consommateurs: Bon
"Boutique OfficielleDELL LATITUDE E5540 CORE I3-4030U (1,90Ghz)- RAM 4Go - HDD 500Go ( Remis à Neuf )",Marque: DELL ,"1,399.00 Dhs","1,799.00 Dhs",22%,3 articles seulement,4 out of 5,(43 avis vérifiés),"3 out of 5le chargeur ne fonctionne pasJ'ai reçus le pc avec un chargeur endommagé , malheureusement c'est la deuxième fois que j'achète un pc dell et je trouve que le chargeur ne marche pas 23-09-2024par HibaAchat vérifié","5 out of 5Bonne qualité Je recommande cette boutique 
07-06-2024par Majda Achat vérifié",74%Évaluation du vendeur788 AbonnésSuivre,Performance vendeurVitesse d'expédition: ExcellentScore Qualité: MauvaisAvis des consommateurs: Bon
Mini Microphone Wired Mic For Phone - Pc Computer,Les commandes Jumia Express sont éligibles à la livraison gratuite. Offre soumise à conditionsAdieu au temps perdu aux péages. Rechargez votre Pass Jawaz maintenant et gagnez votre temps !,99.00 Dhs,119.00 Dhs,17%,3 articles seulement,0 out of 5,(Pas d'avis disponibles),Nan,Nan,46%Évaluation du vendeur23 AbonnésSuivre,Performance vendeurVitesse d'expédition: BonScore Qualité: Très MauvaisAvis des consommateurs: Moyen
UCOM Packs 2 Manette De Jeu Filaire USB pour PC - Original  (NOIR),Marque: UCOM ,119.00 Dhs,300.00 Dhs,60%,5 articles seulement,4 out of 5,(1 avis vérifié),Nan,Nan,86%Évaluation du vendeur10 AbonnésSuivre,Performance vendeurVitesse d'expédition: MoyenScore Qualité: ExcellentAvis des consommateurs: Excellent
"Boutique OfficielleLenovo M82 SFF Intel Celeron G1610 (2,6GHz) - RAM 4Go , HDD 500Go (Remis à Neuf)",Marque: Lenovo ,550.00 Dhs,"1,250.00 Dhs",56%,5 articles seulement,4.4 out of 5,(5 avis vérifiés),Nan,Nan,74%Évaluation du vendeur788 AbonnésSuivre,Performance vendeurVitesse d'expédition: ExcellentScore Qualité: MauvaisAvis des consommateurs: Bon
"Hub Répartiteur USB 3.0 Hub à 4 Ports haute vitesse pour MacBook Pro, adaptateur HUB USB 3.0",Marque: Hub ,49.00 Dhs,150.00 Dhs,67%,Nan,4.5 out of 5,(2 avis vérifiés),Nan,Nan,86%Évaluation du vendeur541 AbonnésSuivre,Performance vendeurVitesse d'expédition: ExcellentScore Qualité: BonAvis des consommateurs: Bon
Canon Cartouche  445 noir,Marque: Canon ,225.00 Dhs,300.00 Dhs,25%,1 articles seulement,0 out of 5,(Pas d'avis disponibles),Nan,Nan,60%Évaluation du vendeur143 AbonnésSuivre,Performance vendeurVitesse d'expédition: BonScore Qualité: Très MauvaisAvis des consommateurs: Bon
Boutique OfficielleSmartedge Adventures Sac à dos 'SEA' Noir,Marque: Smartedge Adventures ,149.00 Dhs,220.00 Dhs,32%,Disponible,3 out of 5,(1 avis vérifié),Nan,Nan,94%Évaluation du vendeur67 AbonnésSuivre,Performance vendeurVitesse d'expédition: ExcellentScore Qualité: BonAvis des consommateurs: Excellent
"Adaptateur USB Type-C 7-in-1, avec 5 USB Ports, 2 Type-C, USB 3.0 USB 2.0",Les commandes Jumia Express sont éligibles à la livraison gratuite. Offre soumise à conditionsAdieu au temps perdu aux péages. Rechargez votre Pass Jawaz maintenant et gagnez votre temps !,200.00 Dhs,250.00 Dhs,20%,4 articles seulement,0 out of 5,(Pas d'avis disponibles),Nan,Nan,74%Évaluation du vendeur50 AbonnésSuivre,Performance vendeurVitesse d'expédition: ExcellentScore Qualité: MoyenAvis des consommateurs: Moyen
Adapter Convertisseur USB 3.0 type C vers HDMI,Les commandes Jumia Express sont éligibles à la livraison gratuite. Offre soumise à conditionsAdieu au temps perdu aux péages. Rechargez votre Pass Jawaz maintenant et gagnez votre temps !,89.00 Dhs,120.00 Dhs,26%,Nan,5 out of 5,(1 avis vérifié),Nan,Nan,74%Évaluation du vendeur177 AbonnésSuivre,Performance vendeurVitesse d'expédition: ExcellentScore Qualité: MoyenAvis des consommateurs: Moyen
"DELL OPTIPLEX 7010 SFF CORE I5-3470 8Go / 500Go + PHILIPS 22"" 220B2 (REMIS À NEUF)",Marque: DELL ,"1,550.00 Dhs","1,860.00 Dhs",17%,8 articles seulement,4 out of 5,(1 avis vérifié),Nan,Nan,74%Évaluation du vendeur788 AbonnésSuivre,Performance vendeurVitesse d'expédition: ExcellentScore Qualité: MauvaisAvis des consommateurs: Bon
"All in One HDD Docking Station - Boitier de Disque dur 2.5"" 3.5"" HDD SSD SATA IDE Carte SD/MS ...",HDD Docking Station...,249.00 Dhs,255.00 Dhs,2%,Nan,4.4 out of 5,(5 avis vérifiés),5 out of 5GoodWorks well. But need some pc setting first. I recommend it.22-04-2022par OtmanAchat vérifié,"3 out of 5Pas très pratiqueDesign pas du tout pratique. Risque d'endommager les connectiques des vieux disques durs IDE.
Pour les autres disques, ça va mieux02-10-2020par MOHAMEDAchat vérifié",86%Évaluation du vendeur541 AbonnésSuivre,Performance vendeurVitesse d'expédition: ExcellentScore Qualité: BonAvis des consommateurs: Bon
2 Toner Laser Compatible  17A / CF217A,...X2,260.00 Dhs,260.00 Dhs,0,Disponible,3 out of 5,(3 avis vérifiés),Nan,Nan,100%Évaluation du vendeur58 AbonnésSuivre,Performance vendeurVitesse d'expédition: ExcellentScore Qualité: ExcellentAvis des consommateurs: Excellent
Boutique OfficielleCable d'alimentation secteur 220V pour PC imprimante longeur  1.5 M,Les commandes Jumia Express sont éligibles à la livraison gratuite. Offre soumise à conditionsAdieu au temps perdu aux péages. Rechargez votre Pass Jawaz maintenant et gagnez votre temps !,41.00 Dhs,59.00 Dhs,31%,Disponible,4.7 out of 5,(3 avis vérifiés),Nan,Nan,86%Évaluation du vendeur77 AbonnésSuivre,Performance vendeurVitesse d'expédition: BonScore Qualité: ExcellentAvis des consommateurs: Bon
"Adaptateur USB vers RJ45 , Adapter USB to RJ45",Marque: Adaptateur ,54.00 Dhs,74.00 Dhs,27%,7 articles seulement,3.6 out of 5,(12 avis vérifiés),1 out of 5mauvaiseMauvaise !!!!12-04-2024par MohcineAchat vérifié,5 out of 5راءع جداراءع جدا28-04-2023par LoubnaAchat vérifié,86%Évaluation du vendeur160 AbonnésSuivre,Performance vendeurVitesse d'expédition: ExcellentScore Qualité: BonAvis des consommateurs: Bon
DELL Pc i7 4éme 16 Go RAM- 256Go SSD - OPTIPLEX 9020sff -remis à neuf,Marque: DELL ,"1,790.00 Dhs","3,990.00 Dhs",55%,6 articles seulement,5 out of 5,(1 avis vérifié),Nan,Nan,60%Évaluation du vendeur122 AbonnésSuivre,Performance vendeurVitesse d'expédition: ExcellentScore Qualité: Très MauvaisAvis des consommateurs: Bon
"XIAOMI Mi Desktop Monitor 27 pouces, 100Hz, FHD 1080P, IPS, angle de vision de 178",Marque: XIAOMI ,"1,999.00 Dhs","2,999.00 Dhs",33%,Nan,4 out of 5,(2 avis vérifiés),Nan,Nan,66%Évaluation du vendeur1579 AbonnésSuivre,Performance vendeurVitesse d'expédition: ExcellentScore Qualité: MauvaisAvis des consommateurs: Moyen
Toner Compatible HP W1106A 106A Pour HP Laser MFP 135a/135w/w135r/137fnw et HP Laser 107a/107w/107r,Les commandes Jumia Express sont éligibles à la livraison gratuite. Offre soumise à conditionsAdieu au temps perdu aux péages. Rechargez votre Pass Jawaz maintenant et gagnez votre temps !,149.00 Dhs,450.00 Dhs,67%,Nan,4.1 out of 5,(7 avis vérifiés),3 out of 5nicepratique04-06-2024par aymaneAchat vérifié,5 out of 5SuperSuper produit03-04-2023par DominiqueAchat vérifié,60%Évaluation du vendeur143 AbonnésSuivre,Performance vendeurVitesse d'expédition: BonScore Qualité: Très MauvaisAvis des consommateurs: Bon
"Boutique OfficielleHp PC Portable Probook 640 Core intel i3-1000Go-RAM 16GB 14""- remis a neuf",Marque: Hp ,"2,999.00 Dhs","3,799.00 Dhs",21%,Disponible,1 out of 5,(1 avis vérifié),Nan,Nan,46%Évaluation du vendeur249 AbonnésSuivre,Performance vendeurVitesse d'expédition: BonScore Qualité: Très MauvaisAvis des consommateurs: Moyen
Boutique OfficielleJedel Pack Combo Gaming Clavier + Souris USB Filaire RGB Backlighting effect,Marque: Jedel ,129.00 Dhs,288.00 Dhs,55%,Disponible,3.9 out of 5,(71 avis vérifiés),1 out of 5NONSOURIS MZWRA15-12-2023par BRAHIMAchat vérifié,2 out of 5سيىلا انصح به01-09-2022par YassineAchat vérifié,74%Évaluation du vendeur2161 AbonnésSuivre,Performance vendeurVitesse d'expédition: ExcellentScore Qualité: MoyenAvis des consommateurs: Moyen
"DELL LATITUDE E5530 - CORE I5-3210M (2.5GHz) 15.6"" HD - 8Go , 256Go SSD Go ( Remis à Neuf ) - AZERTY",Marque: DELL ,"1,799.00 Dhs","3,999.00 Dhs",55%,2 articles seulement,4 out of 5,(4 avis vérifiés),5 out of 5Dell E5530Très bonne performance. Le pc réagit vraiment vite. Je recommande.03-07-2023par EddyAchat vérifié,"4 out of 5j'aimeEn général bon article , article remis à neuf mais la batterie laisse beaucoup à  désirer.28-06-2022par BennaceurAchat vérifié",74%Évaluation du vendeur788 AbonnésSuivre,Performance vendeurVitesse d'expédition: ExcellentScore Qualité: MauvaisAvis des consommateurs: Bon
Lecteur et Graveur DVD - CD externe Dvd CD Usb 3.0 Ultra Slim Portable *8 -Noir,...noir,249.00 Dhs,299.00 Dhs,17%,Nan,4.8 out of 5,(22 avis vérifiés),5 out of 5très bienProduit conforme à ce qui est publié.  Bon rapport qualité prix17-09-2024par OthmaneAchat vérifié,5 out of 5bon rapport q/ple fil usb nest pas détachable. risque d'usure et de besoin de répararer en ouvrant le lecteur.13-03-2024par hadiAchat vérifié,86%Évaluation du vendeur160 AbonnésSuivre,Performance vendeurVitesse d'expédition: ExcellentScore Qualité: BonAvis des consommateurs: Bon
Hp Imprimante Multifonction Jet d'encre Deskjet 2710 (5AR83B),Marque: Hp ,550.00 Dhs,650.00 Dhs,15%,9 articles seulement,0 out of 5,(Pas d'avis disponibles),Nan,Nan,94%Évaluation du vendeur13 AbonnésSuivre,Performance vendeurVitesse d'expédition: BonScore Qualité: ExcellentAvis des consommateurs: Excellent
Boutique OfficielleSH Souris de jeu gamer PRO RGB Capteur Optique 1200 à 3200 DPI LED 6 boutons,Marque: SH ,68.00 Dhs,150.00 Dhs,55%,Disponible,4.8 out of 5,(4 avis vérifiés),Nan,Nan,74%Évaluation du vendeur2161 AbonnésSuivre,Performance vendeurVitesse d'expédition: ExcellentScore Qualité: MoyenAvis des consommateurs: Moyen
Hp Elitedesk 800 G3 Mini WiFi Core i5-6500T - 8Go DDR4 - 500Go HDD - Win 10 Pro (Remis à Neuf),Marque: Hp ,"1,599.00 Dhs","3,799.00 Dhs",58%,9 articles seulement,5 out of 5,(2 avis vérifiés),Nan,Nan,74%Évaluation du vendeur788 AbonnésSuivre,Performance vendeurVitesse d'expédition: ExcellentScore Qualité: MauvaisAvis des consommateurs: Bon
KIOXIA Clé 32 Go USB 2.0 : Stockez vos données en toute simplicité,Marque: KIOXIA ,59.00 Dhs,59.00 Dhs,0,3 articles seulement,4.6 out of 5,(5 avis vérifiés),5 out of 5usb kioxia Saraha zwina khosan taman ana jarbtha dartfiha win 10 7 8.1 ventu ya3ni 9adya gharad ahsan ikhtiyar binisba taman dyalha o khosan japan 17-10-2024par SmailAchat vérifié,5 out of 5J'aimeC'est 28 gigas mais c'est ok24-06-2024par GhizlaneAchat vérifié,74%Évaluation du vendeur24 AbonnésSuivre,Performance vendeurVitesse d'expédition: ExcellentScore Qualité: MauvaisAvis des consommateurs: Bon
Plantronics Blackwire C720 Casque 2 écouteurs pour PC et GSM (connexion USB et Bluetooth),Marque: Plantronics ,449.00 Dhs,"1,299.00 Dhs",65%,Nan,5 out of 5,(1 avis vérifié),Nan,Nan,74%Évaluation du vendeur788 AbonnésSuivre,Performance vendeurVitesse d'expédition: ExcellentScore Qualité: MauvaisAvis des consommateurs: Bon
adaptateur hdmi vga,Adaptateur hdmi vga NNOIR,39.00 Dhs,70.00 Dhs,44%,Nan,5 out of 5,(1 avis vérifié),Nan,Nan,86%Évaluation du vendeur541 AbonnésSuivre,Performance vendeurVitesse d'expédition: ExcellentScore Qualité: BonAvis des consommateurs: Bon
Adaptateur USB 2.0/3.0 vers 2.5 Sata-III Disque Dur-SSD- + Type-C,Les commandes Jumia Express sont éligibles à la livraison gratuite. Offre soumise à conditionsAdieu au temps perdu aux péages. Rechargez votre Pass Jawaz maintenant et gagnez votre temps !,69.00 Dhs,90.00 Dhs,23%,Nan,0 out of 5,(Pas d'avis disponibles),Nan,Nan,74%Évaluation du vendeur177 AbonnésSuivre,Performance vendeurVitesse d'expédition: ExcellentScore Qualité: MoyenAvis des consommateurs: Moyen
"Adaptateur Support pour 2ème disque dur 2,5 ""SSD Caddy Disque Baie Lecteur Optique Dur 9,0 mm SATA vers SATA,PC Portables",Marque: Adaptateur ,75.00 Dhs,250.00 Dhs,70%,8 articles seulement,4.3 out of 5,(26 avis vérifiés),3 out of 5c okChwiya ghalya mai khadama mazyan28-05-2024par AnouarAchat vérifié,5 out of 5Bon produitça fait quelques mois que je l'ai installé sans rencontrer de problèmes.03-11-2023par GHITAAchat vérifié,86%Évaluation du vendeur541 AbonnésSuivre,Performance vendeurVitesse d'expédition: ExcellentScore Qualité: BonAvis des consommateurs: Bon
Mini Adaptateur USB Bluetooth 5.0,Starexpress.ma,29.00 Dhs,90.00 Dhs,68%,Nan,3.3 out of 5,(3 avis vérifiés),Nan,Nan,74%Évaluation du vendeur177 AbonnésSuivre,Performance vendeurVitesse d'expédition: ExcellentScore Qualité: MoyenAvis des consommateurs: Moyen
Bamboo Table pc BOIS pour Ordinateur Portable Pliable et Réglable,Marque: Bamboo ,299.00 Dhs,350.00 Dhs,15%,9 articles seulement,5 out of 5,(5 avis vérifiés),Nan,Nan,86%Évaluation du vendeur541 AbonnésSuivre,Performance vendeurVitesse d'expédition: ExcellentScore Qualité: BonAvis des consommateurs: Bon
"Molink Casque Bluetooth V.5 , batterie 6 heures Sport d'Appels et de Musique",Marque: Molink ,179.00 Dhs,399.00 Dhs,55%,5 articles seulement,4.6 out of 5,(7 avis vérifiés),4 out of 5BienC'est bien pour le prix14-04-2023par MohamedAchat vérifié,4 out of 5Good qualityNice quality07-04-2023par Anwar Anwar elyousfiAchat vérifié,66%Évaluation du vendeur122 AbonnésSuivre,Performance vendeurVitesse d'expédition: BonScore Qualité: MauvaisAvis des consommateurs: Bon
Boutique OfficielleHp PC BUREAU ProDesk 400-i5-RAM 16Go 256Go SSD-souris+clavier GRATUIT-REMIS A NEUF/,Marque: Hp ,"1,479.00 Dhs","1,988.00 Dhs",26%,Disponible,4 out of 5,(3 avis vérifiés),3 out of 5لابأس بهقديم بعض شئ و فيه خدش صغير17-09-2024par ABDELGHANIAchat vérifié,4 out of 5????????جيد28-03-2024par Hamza ChahbounAchat vérifié,46%Évaluation du vendeur249 AbonnésSuivre,Performance vendeurVitesse d'expédition: BonScore Qualité: Très MauvaisAvis des consommateurs: Moyen
"Sandisk Clé USB 16GB V3.0 Flash Drive, Cruzer Blade DataTraveler",Marque: Sandisk ,54.00 Dhs,69.00 Dhs,22%,Disponible,5 out of 5,(1 avis vérifié),Nan,Nan,86%Évaluation du vendeur3586 AbonnésSuivre,Performance vendeurVitesse d'expédition: ExcellentScore Qualité: BonAvis des consommateurs: Bon
"Toshiba Disque Dur externe 1 TB USB 2.5"" Fast Speed pour Pc",Marque: Toshiba ,380.00 Dhs,650.00 Dhs,42%,Nan,4.3 out of 5,(4 avis vérifiés),Nan,Nan,66%Évaluation du vendeur830 AbonnésSuivre,Performance vendeurVitesse d'expédition: ExcellentScore Qualité: MauvaisAvis des consommateurs: Moyen
DELL Sac D'ordinateur Portable Multipoches 15 pouces pour Hommes et Femmes Sac à Main d'affaires - Noir,Marque: DELL ,165.00 Dhs,487.00 Dhs,66%,Disponible,4 out of 5,(14 avis vérifiés),"4 out of 5bonne qualitéTrès bien, ultra fin15-07-2024par Lee jayaAchat vérifié","3 out of 5assez bonFabriqué avec un meilleur matériel, ce serais mieux16-02-2023par ElmostaphaAchat vérifié",74%Évaluation du vendeur2161 AbonnésSuivre,Performance vendeurVitesse d'expédition: ExcellentScore Qualité: MoyenAvis des consommateurs: Moyen
Port USB 2.0/3.0 vers RJ45 Ethernet Lan avec 3 ports USB Hub Pour Macbook et PC,Marque: Port ,89.00 Dhs,200.00 Dhs,56%,1 articles seulement,3.8 out of 5,(4 avis vérifiés),Nan,Nan,86%Évaluation du vendeur541 AbonnésSuivre,Performance vendeurVitesse d'expédition: ExcellentScore Qualité: BonAvis des consommateurs: Bon
Boutique OfficielleJedel gaming keyboard k-590clavier blaklighit Clavier USB Gaming LED,Marque: Jedel ,94.00 Dhs,220.00 Dhs,57%,Disponible,4.2 out of 5,(22 avis vérifiés),"3 out of 5just so soThe picture is not right.
I believe What you see is what you get, but it is an arabic keyboard, even though the picture is of an English one.02-07-2024par BillAchat vérifié",5 out of 5miriVraiment c'est magnifique 28-05-2024par bensalemAchat vérifié,74%Évaluation du vendeur2161 AbonnésSuivre,Performance vendeurVitesse d'expédition: ExcellentScore Qualité: MoyenAvis des consommateurs: Moyen
Orico HUB USB 4CH FL01 - 4 Ports USB 2.0 Haute Vitesse Up to 480Mbps support OTG,Marque: Orico ,54.00 Dhs,69.00 Dhs,22%,Disponible,3.9 out of 5,(68 avis vérifiés),1 out of 5خسرات فسيمانا لولامعرفتش كالها ولكين كا خداماش12-07-2024par ZakariaAchat vérifié,1 out of 5Jnp çaQuality 008-07-2024par MehdiAchat vérifié,86%Évaluation du vendeur541 AbonnésSuivre,Performance vendeurVitesse d'expédition: ExcellentScore Qualité: BonAvis des consommateurs: Bon
"Lecteur externe USB 3.0 CD/DVD, transfert de données à grande vitesse",Les commandes Jumia Express sont éligibles à la livraison gratuite. Offre soumise à conditionsAdieu au temps perdu aux péages. Rechargez votre Pass Jawaz maintenant et gagnez votre temps !,230.00 Dhs,290.00 Dhs,21%,1 articles seulement,3 out of 5,(2 avis vérifiés),Nan,Nan,74%Évaluation du vendeur177 AbonnésSuivre,Performance vendeurVitesse d'expédition: ExcellentScore Qualité: MoyenAvis des consommateurs: Moyen
Sacoche ordinateur Case Cover sac Pour PC portable 13 pouces pochet,13pouces,85.00 Dhs,119.00 Dhs,29%,Nan,4.5 out of 5,(4 avis vérifiés),Nan,Nan,86%Évaluation du vendeur61 AbonnésSuivre,Performance vendeurVitesse d'expédition: ExcellentScore Qualité: ExcellentAvis des consommateurs: Moyen
"Adaptateur DVI HDMI, Connecteur DVI D 24+1 Mâle vers HDMI Femelle Support 1080P",Offre Flash,29.00 Dhs,49.00 Dhs,41%,Nan,4.4 out of 5,(8 avis vérifiés),"5 out of 5ممتازة جداتعمل بشكل جيد
07-03-2024par abdelhakAchat vérifié","5 out of 5useful adapterit does its job very well , i am using it to connect my hdmi laptop to  my dvi-d monitor . perfectly works .26-06-2023par AnasAchat vérifié",74%Évaluation du vendeur177 AbonnésSuivre,Performance vendeurVitesse d'expédition: ExcellentScore Qualité: MoyenAvis des consommateurs: Moyen
housse pour ordinateur portable sacoche léger et portable pour pc 13 pouces,Les commandes Jumia Express sont éligibles à la livraison gratuite. Offre soumise à conditionsAdieu au temps perdu aux péages. Rechargez votre Pass Jawaz maintenant et gagnez votre temps !,117.00 Dhs,169.00 Dhs,31%,Nan,3 out of 5,(1 avis vérifié),Nan,Nan,86%Évaluation du vendeur61 AbonnésSuivre,Performance vendeurVitesse d'expédition: ExcellentScore Qualité: ExcellentAvis des consommateurs: Moyen
Boutique OfficielleUgreen Adaptateur USB type C Vert RJ45 ETHERNET 1000Mbps (50737),Marque: Ugreen ,246.00 Dhs,290.00 Dhs,15%,4 articles seulement,0 out of 5,(Pas d'avis disponibles),Nan,Nan,94%Évaluation du vendeur67 AbonnésSuivre,Performance vendeurVitesse d'expédition: ExcellentScore Qualité: BonAvis des consommateurs: Excellent
"Sac à dos pour pc, voyage, affaires, 3pcs cartable + sac à bandoulière + trousse",Les commandes Jumia Express sont éligibles à la livraison gratuite. Offre soumise à conditionsAdieu au temps perdu aux péages. Rechargez votre Pass Jawaz maintenant et gagnez votre temps !,157.00 Dhs,199.00 Dhs,21%,Nan,3 out of 5,(2 avis vérifiés),Nan,Nan,80%Évaluation du vendeur52 AbonnésSuivre,Performance vendeurVitesse d'expédition: ExcellentScore Qualité: MoyenAvis des consommateurs: Bon
